schedule,mdrm,caption
RCCII,RCON5589,"OTSTDG BAL > $250,000 THRU $500,000"
RCE,RCON5590,PREFERRED DEPOSITS
RCL,RCON5591,ALL OTHER OFF-BALANCE SHEET ASSETS
RCL,RCON5592,1ST ITMZD&DESCRPTN LINE CPNT OF 5591
RCL,RCON5593,2ND ITMZD&DESCRPTN LINE CPNT OF 5591
RCL,RCON5594,3RD ITMZD&DESCRPTN LINE CPNT OF 5591
RCL,RCON5595,4TH ITMZD&DESCRPTN LINE CPNT OF 5591
RCO,RCON5596,DEPOSITS IN LIFELINE ACCOUNTS
RCO,RCON5597,ESTIMATE OF UNINSURED DEPOSITS
RCR,RCON5610,DEFRD TAX ASSETS DISALWD FOR REGLTRY
RCN,RCON5612,LNS&LEASES WHLY GUAR-PST DU 30-89 DY
RCN,RCON5613,LNS&LEASES WHLY GUAR-PST DU 90DYS OR
RCN,RCON5614,LNS&LEASES WHLY GUAR-NONACCRUAL
RCN,RCON5615,GUAR PORTN OF LNS&LS-PST DU 30-89 DY
RCN,RCON5616,GUAR PORTN OF LNS&LS-PST DU 90DYS OR
RCN,RCON5617,GUAR PORTN OF LNS&LS-NONACCRUAL
RCM,RCON6164,AGGREG AKT OF EXT OF CREDIT TO EXECS
RCM,RCON6165,# OF EXEC OFFCRSEPRIN SHAREHOLDERS
RCL,RCON6550,COMMITMTS TO FUND LNS NOT SECD BY RE
RCN,RCON6558,"COMMCL RE,ETC.-PAST DUE 30-89 DYS,AG"
RCN,RCON6559,"COMMCL RE,ETC.-PAST DUE 90DYS OR MOR"
RCN,RCON6560,"COMMCL RE,ETC.-NONACCRUAL"
RC,RCON6631,NON-INTEREST BEARING DEPOSITS
RC,RCON6636,TOT INT BEAR DEPS IN DOM&FGN OFF
RCE,RCON6648,TIME DEPOSITS LT 100000
RC,RCON6724,AUDIT INDICATOR
RCE,RCON6810,AMT OUTSTDG IN MONEY MARKET DEP ACCT
RCE,RCON6835,IRA AND KEOGH PLAN ACCOUNTS
RCCII,RCON6860,AGRICLTRL LNS TO SMALL FARMS INDCTR
RCO,RCON6861,EST AMT OF UNINSURD DEPS METHD INDCT
NARR,RCON6979,NO COMMENT-BK MANAGEMENT STATEMENT
RCCII,RCON6999,LOANS TO SMALL BUSINESSES INDICATOR
RCR,RCON7204,TIER 1 LEVERAGE CAPITAL RATIO
RCR,RCON7205,TOTAL RISK-BASED CAPITAL RATIO
RCR,RCON7206,TIER 1 RISK-BASED CAPITAL RATIO
RCR,RCON7273,TIER 1 LEVERAGE RATIO
RCR,RCON7274,TIER 1 RISK-BASED CAPITAL RATIO
RCR,RCON7275,TOTAL RISK-BASED CAPITAL RATIO
LEO,RCON7701,RGE OF INT CHG ON LNS TO EXEC OFF-FR
LEO,RCON7702,RGE OF INT CHG ON LNS TO EXEC OFF-TO
RCR,RCON8274,TIER 1 CPTL ALLWBL UNDR RISK-BASED
RCR,RCON8275,TIER 2 CPTL ALLWBL UNDR RISK-BASED
RCO,RCON8432,BENFT-RESPNSV DEPSTRY INSTN INVSTMT
RCR,RCON8434,NET UNRELZD HLDG GAINS(LOSS) ON AVL
RCH,RCON8492,US GOVT AGCY&CORP OBLIGS-AMRTZ COST
RCH,RCON8495,US GOVT AGCY&CORP OBLIGS-FAIR VALUE
RCB,RCON8496,SECS ISSD BY US ST&POL SUBDYS-AMRTZ
RCB,RCON8497,SECS ISSD BY US ST&POL SUBDYS-FAIR
RCB,RCON8498,SECS ISSD BY US ST&POL SUBDYS-AMRTZ
RCB,RCON8499,SECS ISSD BY US ST&POL SUBDYS-FAIR
RC,RCON8678,FISCAL YEAR END
RCL,RCON8693,FUTURES INT RATE CONTRACTS-NOTIONAL
RCL,RCON8694,FUTURES FGN EXCHG CONTRACTS-NOTIONAL
RCL,RCON8695,FUTURES EQTY DERIVATIVE CONTRACTS
RCL,RCON8696,FUTURES COMMODITY&OTHER CONTRACTS
RCL,RCON8697,FORWARDS INT RATE CONTRACTS-NOTIONAL
RCL,RCON8698,FORWARDS FGN EXCHG CONTRACTS-NOTIONL
RCL,RCON8699,FORWARDS EQTY DERIVATIVE CONTRACTS
RCL,RCON8700,FORWARDS COMMODITY&OTHER CONTRACTS
RCL,RCON8701,WRITTEN INT RATE CONTRACTS-EXCHG TRD
RCL,RCON8702,WRITTEN FGN EXCHG CONTRACTS-EXCH TRD
RCL,RCON8703,WRITTEN EQTY DERIVATIVE CONTRACTS
RCL,RCON8704,WRITTEN COMMODITY&OTHER CONTRACTS
RCL,RCON8705,PURCHSD INT RATE CONTRACTS-EXCHG TRD
RCL,RCON8706,PURCHSD FGN EXCHG CONTRACTS-EXCH TRD
RCL,RCON8707,PURCHSD EQTY DERIVATIVE CONTRACTS
RCL,RCON8708,PURCHSD COMMODITY&OTHER CONTRACTS
RCL,RCON8709,WRITTEN INT RATE CONTRACTS-OTC
RCL,RCON8710,WRITTEN FGN EXCHG CONTRACTS-OTC
RCL,RCON8711,WRITTEN EQTY DERIVATIV CONTRACTS-OTC
RCL,RCON8712,WRITTEN COMMODITY&OTHR CONTRACTS-OTC
RCL,RCON8713,PURCHSD INT RATE CONTRACTS-OTC
RCL,RCON8714,PURCHSD FGN EXCHG CONTRACTS-OTC
RCL,RCON8715,PURCHSD EQTY DERIVATIV CONTRACTS-OTC
RCL,RCON8716,PURCHSD COMMODITY&OTHR CONTRACTS-OTC
RCL,RCON8719,NOTIONAL VALUE OF EQTY DERVTIV SWAPS
RCL,RCON8720,NOTIONAL VALUE OF COMMODTY&OTH SWAPS
RCL,RCON8723,TOTL EQTY DEV CONTRCS-HELD FOR TRDG
RCL,RCON8724,TOTL CMDY&OTH CONTRCS-HELD FOR TRDG
RCL,RCON8725,TOTL INT RATE CONTRCS-MKD TO MARKET
RCL,RCON8726,TOTL FGN EXCH CONTRCS-MKD TO MARKET
RCL,RCON8727,TOTL EQTY DEV CONTRCS-MKD TO MARKET
RCL,RCON8728,TOTL CMDY&OTH CONTRCS-MKD TO MARKET
RCL,RCON8733,GRS POSTV FAIR VALU OF INT RATE CNTR
RCL,RCON8734,GRS POSTV FAIR VALU OF FGN EXCH CNTR
RCL,RCON8735,GRS POSTV FAIR VALU OF EQTY DEV CNTR
RCL,RCON8736,GRS POSTV FAIR VALU OF CMDY&OTH CNTR
RCL,RCON8737,GRS NEGTV FAIR VALU OF INT RATE CNTR
RCL,RCON8738,GRS NEGTV FAIR VALU OF FGN EXCH CNTR
RCL,RCON8739,GRS NEGTV FAIR VALU OF EQTY DEV CNTR
RCL,RCON8740,GRS NEGTV FAIR VALU OF CMDY&OTH CNTR
RCL,RCON8741,GR POS FR VAL OF INT RATE-MKD TO MKT
RCL,RCON8742,GR POS FR VAL OF FGN EXCH-MKD TO MKT
RCL,RCON8743,GR POS FR VAL OF EQTY DEV-MKD TO MKT
RCL,RCON8744,GR POS FR VAL OF CMDY&OTH-MKD TO MKT
RCL,RCON8745,GR NEG FR VAL OF INT RATE-MKD TO MKT
RCL,RCON8746,GR NEG FR VAL OF FGN EXCH-MKD TO MKT
RCL,RCON8747,GR NEG FR VAL OF EQTY DEV-MKD TO MKT
RCL,RCON8748,GR NEG FR VAL OF CMDY&OTH-MKD TO MKT
RCR,RCON8764,NET CURRENT CREDIT EXPOSURE
RCL,RCON8765,SPOT FOREIGN EXCHANGE CONTRACTS
RCR,RCON8766,INT RATE CONTRCTS-MAT OVER1THRU5 YRS
RCR,RCON8767,INT RATE CONTRCTS-MAT OVER 5 YEARS
RCR,RCON8769,FGN EXCHG RATE CNTRCS-MAT OVR1-5 YRS
RCR,RCON8770,FGN EXCHG RATE CNTRCS-MAT OVER 5 YRS
RCR,RCON8771,GOLD CONTRACTS-MAT ONE YEAR OR LESS
RCR,RCON8772,GOLD CONTRACTS-MAT OVER 1 THRU 5 YRS
RCR,RCON8773,GOLD CONTRACTS-MAT OVER 5 YEARS
RCR,RCON8774,OTH PRECS METL-MAT ONE YEAR OR LESS
RCR,RCON8775,OTH PRECS METL-MAT OVER 1 THRU 5 YRS
RCR,RCON8776,OTH PRECS METL-MAT OVER 5 YEARS
RCR,RCON8777,OTHR COMMODITY-MAT ONE YEAR OR LESS
RCR,RCON8778,OTHR COMMODITY-MAT OVER 1 THRU 5 YRS
RCR,RCON8779,OTHR COMMODITY-MAT OVER 5 YEARS
RCB,RCON8782,AMORTIZED COST OF STRUCTURED NOTES
RCB,RCON8783,FAIR VALUE OF STRUCTURED NOTES
RCO,RCON8785,AMT DEM DEP REDUC IF BALS REP NET BS
ENT,RCON9224,ID_LEI
ENT,RCON9999,MICR9999REPORT DATE
RCR,RCONA000,EQUITY CONTRCT-MAT ONE YEAR OR LESS
RCR,RCONA001,EQUITY CONTRCT-MAT OVER 1 THRU 5 YRS
RCR,RCONA002,EQUITY CONTRCT-MAT OVER 5 YEARS
RCL,RCONA126,TOTAL INT RATE CONTRACTS TRADING
RCL,RCONA127,TOTAL FGN EXCH CONTRACTS TRADING
RC,RCONA130,OTHER COMPONENTS OF EQUITY CAPITAL
RCR,RCONA167,EQUIV AMT OF OFF-B/S DERIVATIVES
RCO,RCONA181,INCR IN DEM DEP IF RECIP BAL GROSS
RCO,RCONA182,DECR IN DEM DEP IF CIPC INCLUDED
RCR,RCONA221,NET UNREAL LOSS ON AFS EQTY SEC
RCR,RCONA222,EXCESS ALLOWANCE FOR LN&LEASE LOSSES
RCR,RCONA223,RISK-WEIGHTED ASSETS
RCR,RCONA224,AVERAGE TOTAL ASSETS
RCE,RCONA241,TM DEPS LT 100000 MAT LESS 1 YR
RCE,RCONA242,TIME DEPS GE 100000 MAT LESS 1 YR
RCE,RCONA243,BROKERED DEPS LT 100000 MAT LE 1 YR
RCE,RCONA244,BROKERED DEPS GE 100000 MAT LE 1 YR
RCCI,RCONA247,FXD&FLTG RT LNS&LEASES MAT 1 YR OR L
RCB,RCONA248,FXD&FLTG RT DEBT SECS MAT 1 YR OR LE
RCS,RCONA249,OUTSTDG PRNCPL BALC OF SBO'S TRANSFD
RCR,RCONA250,AMT OF RETAINED RECOURSE ON SBO'S
RCT,RCONA345,FIDUCIARY POWERS GRTD NOT EXERCISED
RCT,RCONA346,FIDCRY PWRS GRTD&EXERCSD NO DOLR RPT
RCB,RCONA510,AMTZ COS OF AVL-FOR-SL INVES MUTL FD
RCB,RCONA511,FAIR VAL OF AVL-FOR-SL INVES MUTL FD
RCK,RCONA514,"QTR AVG TIME DEPOSITS >= $100,000"
RCF,RCONA519,INT-ONLY STRIPS RCVBL ON:MORTG LOANS
RCF,RCONA520,INT-ONLY STRPS RCVBL ON:OT FIN ASSTS
RCS,RCONA521,OUTSTDG PRNCPL BAL OF MTGES TRANSFRD
RCS,RCONA522,AMT OF RECOURSE EXPSRE ON THESE MTGS
RCS,RCONA523,OUTSTDG PRNCPL BAL ASSETS TRANSFRD
RCS,RCONA524,AMT OF RECOURSE EXPSRE ON THESE ASTS
RCO,RCONA527,AMT OF ASSETS NETTED AGST DMND DEPS
RCO,RCONA528,AMT OF ASSETS NETTED AGST SVGS DEPS
RCK,RCONA529,"QTR AVG TIME DEPOSITS < $100,000"
RCO,RCONA531,TOTL DEPS PURCHD/ACQRD FROM OTH FDIC
RCO,RCONA532,AMT OF PURCHD/ACQRD DPS RPTD IN A531
RCO,RCONA533,TOTL DEPS SOLD OR TRNSFRD DURING QTR
RCL,RCONA534,CRD DERIV WHICH RPTG BK IS GUARANTOR
RCL,RCONA535,CRD DERIV WHICH RPTG BK IS BENEFICRY
RCO,RCONA545,PB/PSA FDIC CERTIFICATE NUMBER
RCB,RCONA549,"SECS ISD BY US TREAS,ETC 3 MOS LESS"
RCB,RCONA550,"SECS ISD BY US TREAS,ETC OV 3-12 MOS"
RCB,RCONA551,"SECS ISD BY US TREAS,ETC OV 1-3 YRS"
RCB,RCONA552,"SECS ISD BY US TREAS,ETC OV 3-5 YRS"
RCB,RCONA553,"SECS ISD BY US TREAS,ETC OV 5-15 YRS"
RCB,RCONA554,"SECS ISD BY US TREAS,ETC OVER 15 YRS"
RCB,RCONA555,MTGE PASS-THRU SECS MAT 3 MONTHS LES
RCB,RCONA556,MTGE PASS-THRU SECS MAT OV 3-12 MTHS
RCB,RCONA557,MTGE PASS-THRU SECS MAT OV 1 - 3 YRS
RCB,RCONA558,MTGE PASS-THRU SECS MAT OV 3 - 5 YRS
RCB,RCONA559,MTGE PASS-THRU SECS MAT OV 5 - 15 YR
RCB,RCONA560,MTGE PASS-THRU SECS MAT OVER 15 YEAR
RCB,RCONA561,OTHER MTG-BCKD SECS 3 YEARS OR LESS
RCB,RCONA562,OTHER MTG-BCKD SECS OVER 3 YEARS
RCCI,RCONA564,CLSD-END LNS SECD 1ST LIENS 3 MOS LE
RCCI,RCONA565,CLSD-END LNS SECD 1ST LIENS OV3-12 M
RCCI,RCONA566,CLSD-END LNS SECD 1ST LIENS OV 1-3 Y
RCCI,RCONA567,CLSD-END LNS SECD 1ST LIENS OV 3-5 Y
RCCI,RCONA568,CLSD-END LNS SECD 1ST LIENS OVR 15 Y
RCCI,RCONA569,LOANS SECD BY RE MAT OVER 15 YEARS
RCCI,RCONA570,OTHER LNS&LEASES MAT 3 MONTHS OR LES
RCCI,RCONA571,OTHER LNS&LEASES MAT OVER 3-12 MONTH
RCCI,RCONA572,OTHER LNS&LEASES MAT OVR 1 - 3 YRS
RCCI,RCONA573,OTHER LNS&LEASES MAT OVR 3 - 5 YRS
RCCI,RCONA574,OTHER LNS&LEASES MAT OVR 5 - 15 YRS
RCCI,RCONA575,OTHER LNS&LEASES MATURITY OVER 15 YR
RCE,RCONA579,TM DEPS LT 100000 MAT/REPRCE LE 3 MO
RCE,RCONA580,TM DEPS LT 100000 MAT/REPRCE 3-12 MO
RCE,RCONA581,TM DEPS LT 100000 MAT/REPRCE 1-3 YR
RCE,RCONA582,TM DEPS LT 100000 MAT/REPRCE GT 3 YR
RCE,RCONA584,TM DEPS GE 100000 MAT/REPRCE LE 3 MO
RCE,RCONA585,TM DEPS GE 100000 MAT/REPRCE 3-12 MO
RCE,RCONA586,TM DEPS GE 100000 MAT/REPRCE 1-3 YR
RCE,RCONA587,TM DEPS GE 100000 MAT/REPRCE GT 3 YR
RCL,RCONA589,INT RATE CONTRTS-INTEREST RATE SWAPS
RCM,RCONA590,ESTMTD FAIR VAL OF MTG SERVNG ASSETS
RCS,RCONA591,OTSTDNG PRIN BAL LNS OTH TH 1-4 FAML
RCM,RCONB026,PURCD CRD CD RLSHPS&NONMTG SRVG ASTS
RCS,RCONB500,"AMT OF OWNRSHP,ETC:LOANS-HM EQ LINES"
RCS,RCONB501,"AMT OF OWRSHP,ETC:LOANS-CRDT CRD RCV"
RCS,RCONB502,"AMT OF OWNRSHP,ETC:LOANS-CMMRL&INDUS"
RCR,RCONB503,ADJSTMNT TO TOTL RSK-BASED CPTL
RCR,RCONB504,ADJUSTMENT TO RWA
RCR,RCONB505,ADJUSTMENT TO AVERAGE TOTAL ASSETS
RCR,RCONB520,FED FNDS SLD&SECS PRCHD UDR AGMT-100
RC,RCONB528,"LOANS & LEASES, NET UNEARNED INCOME"
RC,RCONB529,"LOANS & LEASES, NET UNEARN INC&ALLOW"
RC,RCONB530,ACCUMULATED OTH COMPREHENSIVE INCOME
RCCI,RCONB531,LOANS TO COM BANKS IN THE U.S.-DERV
RCCI,RCONB532,LNS TO U.S. BRNCHES&AGNCIES FRGN BKS
RCCI,RCONB533,LNS TO OTHER COMMRCL BKS IN THE U.S.
RCCI,RCONB534,LNS TO OTH DEPSTRY INSTITNS IN U.S.
RCCI,RCONB535,LOANS TO BNKS IN FGN COUN - DERIVED
RCCI,RCONB536,LNS TO FRGN BRNCHES OF OTH U.S. BNKS
RCCI,RCONB537,LNS TO OTH BNKS IN FOREIGN COUNTRIES
RCCI,RCONB538,CREDIT CARDS LOANS
RCCI,RCONB539,OTHER REVOLVING CREDIT PLAN LOANS
RCR,RCONB541,RECOURSE & DIRECT CRD SUBS-FACE VALU
RCR,RCONB542,RECOURSE&DIRCT CRDT SUBS-CRDT EQ AMT
RCR,RCONB543,RECOURSE&DIRECT CRDT SUBSTITS-100%
RCR,RCONB546,FINCL STANDBY LTTRS OF CRD-FACE VALU
RCR,RCONB547,FINCL STANDBY LETTRS OF CRD-EQVL AMT
RCR,RCONB548,FINANCIAL STANDBY LETTRS OF CRDIT-0%
RCE,RCONB549,TRANSACTION ACCTS: IPC DEPOSITS
RCE,RCONB550,NONTRANSACTION ACCTS: IPC DEPOSITS
RCE,RCONB551,TRANSACTION ACCT: CB'S & DI'S IN U.S
RCE,RCONB552,NONTRANSACT ACCT: CB'S & DI'S IN U.S
RCF,RCONB556,ACCRUED INTEREST RECEIVABLE
RCG,RCONB557,ALL0WANCE FOR CREDIT LOSSES OFF B/S
RCK,RCONB558,QTR AVG: U.S. TREAS SEC & GOVT OBLIG
RCK,RCONB559,QTR AVG: MORTGAGE-BACKED SECURITIES
RCK,RCONB560,QTR AVG: ALL OTHER SECURITIES
RCK,RCONB561,QTR AVG: CREDIT CARD LOANS
RCK,RCONB562,QTR AVG: OTHER LOANS TO INDIVIDUALS
RCK,RCONB563,QTR AVG: NONTRANS - SAVING DEPOSITS
RCM,RCONB565,FHLB ADVANCES: MATURING 1-3 YEARS
RCM,RCONB566,FHLB ADVANCES: MATURING > 3 YEARS
RCM,RCONB567,OTHER BORROWINGS MATURING 1-3 YEARS
RCM,RCONB568,OTHER BORROWINGS MATURING > 3 YEARS
RCM,RCONB569,DOES RPRTNG BANK SELL MUTUAL FUNDS?
RCM,RCONB570,ASSETS MANAGED: MUTUAL FUNDS&ANNUITY
RCM,RCONB571,OTHER BORR0WINGS MATURING <= 1 YEAR
RCN,RCONB575,PAST DUE(30-89DA): CREDIT CARD LOANS
RCN,RCONB576,PAST DUE(>=90DAY): CREDIT CARD LOANS
RCN,RCONB577,PAST DUE(NONACCR): CREDIT CARD LOANS
RCN,RCONB578,PAST DUE(30-89DA): OTHER INDIV LOANS
RCN,RCONB579,PAST DUE(>=90DAY): OTHER INDIV LOANS
RCN,RCONB580,PAST DUE(NONACCR): OTHER INDIV LOANS
RCR,RCONB581,FINANCIAL STANDBY LETTRS OF CRDT-20%
RCR,RCONB582,FIANCIAL STANDBY LETTRS OF CRDIT-50%
RCR,RCONB583,FINANCIAL STANDBY LETTRS OF CRD-100%
RCR,RCONB588,NONQUALIFYING PERPETUAL PREFER STOCK
RCR,RCONB589,QUALIFYING MINORITY INT CONSOL SUBS
RCR,RCONB590,DISALLOWD GOODWILL&OTH INTANG ASSETS
RCR,RCONB591,DISALLOWD SERVICING ASSETS & PCCR'S
RCR,RCONB592,OTHER ADDITIONS(DEDUCT) FROM TIER1
RCR,RCONB593,CUMULATIVE PERPETUAL PREFERRED STOCK
RCR,RCONB594,OTHER TIER 2 CAPITAL COMPONENTS
RCR,RCONB595,DEDUCTIONS FOR TOTL RISK-BASED CAPTL
RCR,RCONB596,OTHR DEDUCT FR ASSETS FOR LEVRGE CAP
RCR,RCONB600,CASH & BAL DUE FROM DI'S: 0% RSK-WGT
RCR,RCONB601,CASH & BAL DUE FROM DI'S: 20% RSK-WT
RCR,RCONB602,CASH & BAL DUE FROM DI'S:100% RSK-WT
RCR,RCONB603,H-T-M SECURITIES-NOT SUBJECT RSK-WT
RCR,RCONB604,HELD-TO-MATUR SECURITIES: 0% RSK-WGT
RCR,RCONB605,HELD-TO-MATUR SECURITIES: 20%RSK-WGT
RCR,RCONB606,HELD-TO-MATUR SECURITIES: 50%RSK-WGT
RCR,RCONB607,HELD-TO-MATUR SECURITIES:100%RSK-WGT
RCR,RCONB608,A-F-S SECURITES - NOT SUBJECT RSK-WT
RCR,RCONB609,AVAIL-FOR-SALE SECUR: 0% RISK-WGT
RCR,RCONB610,AVAIL-FOR-SALE SECUR: 20% RISK-WGT
RCR,RCONB611,AVAIL-FOR-SALE SECUR: 50% RISK-WGT
RCR,RCONB612,AVAIL-FOR-SALE SECUR: 100% RISK-WGT
RCR,RCONB613,FED FUNDS SOLD&SEC PUR: 0% RISK-WTG
RCR,RCONB614,FED FUNDS SOLD&SECS PUR: 20% RSK-WGT
RCR,RCONB616,FED FUNDS SOLD&SECS PUR: 100% RSK-WG
RCR,RCONB617,LOANS&LEASES H-F-S: NOT SUBJ RSK-WGT
RCR,RCONB618,LOANS & LEASES H-F-S: 0% RISK-WEIGHT
RCR,RCONB619,LOANS & LEASES H-F-S: 20% RISK-WGT
RCR,RCONB620,LOANS & LEASES H-F-S:-50% RISK-WGT
RCR,RCONB621,LOANS & LEASES H-F-S: 100% RISK-WGT
RCR,RCONB622,"LOANS & LEASES,NET: NOT SUBJ RSK-WGT"
RCR,RCONB623,"LOANS & LEASES, NET: 0% RISK-WEIGHT"
RCR,RCONB624,"LOANS & LEASES, NET: 20% RISK-WEIGHT"
RCR,RCONB625,"LOANS & LEASES, NET: 50% RISK-WEIGHT"
RCR,RCONB626,"LOANS & LEASES,NET: 100% RISK-WEIGHT"
RCR,RCONB627,TRADING ASSETS: NOT SUBJ RISK-WGT
RCR,RCONB628,TRADING ASSETS: 0% RISK-WEIGHT
RCR,RCONB629,TRADING ASSETS: 20% RISK-WEIGHT
RCR,RCONB630,TRADING ASSETS: 50% RISK-WEIGHT
RCR,RCONB631,TRADING ASSETS: 100% RISK-WEIGHT
RCR,RCONB639,OTHER ASSETS - TOTALS
RCR,RCONB640,OTHER ASSETS - NOT SUBJ RISK-WGT
RCR,RCONB641,OTHER ASSETS: 0% RISK-WEIGHT
RCR,RCONB642,OTHER ASSETS: 20% RISK-WEIGHT
RCR,RCONB643,OTHER ASSETS: 50% RISK-WEIGHT
RCR,RCONB644,TOTAL ASSETS: NOT SUBJ RISK-WGT
RCR,RCONB645,FINANCL STNDBY LETTERS OF CRDT-EQVLN
RCR,RCONB646,FINANCL STANDBY LETRS OF CRDT-0% R/W
RCR,RCONB647,FINANCL STANDBY LETRS OF CRDT-20%R/W
RCR,RCONB648,FINANCL STANDBY LETRS OF CRDT-50%R/W
RCR,RCONB649,FINAN STANDBY LETRS OF CRDT-100% R/W
RCR,RCONB650,PERFORM STANDBY LETRS OF CRDT-EQUIV
RCR,RCONB651,PERFORM STANDBY LETRS OF CRDT-0% R/W
RCR,RCONB652,PERFORM STANDBY LETRS OF CRDT-20%R/W
RCR,RCONB653,PERFORM STANDBY LETRS OF CRDT-50%R/W
RCR,RCONB654,PERFORM STANDBY LETRS OF CRDT-100%
RCR,RCONB655,CMMRCL&SIMILAR LETTRS OF CRDT-EQUIVL
RCR,RCONB656,COMMERCIAL &SIM LETRS OF CRDT-0%
RCR,RCONB657,COMMERCIAL &SIM LETRS OF CRDT-20%
RCR,RCONB658,COMMERCIAL &SIM LETRS OF CRDT-50%
RCR,RCONB659,COMMERCIAL &SIM LETRS OF CRDT-100%
RCR,RCONB660,RSK PARTICPTNS IN BKRS ACCPTNCS-EQVL
RCR,RCONB661,RISK PARTIC IN BKRS ACCEPT - 0%
RCR,RCONB662,RISK PARTIC IN BKRS ACCEPT - 20%
RCR,RCONB663,RISK PARTIC IN BKRS ACCEPT - 100%
RCR,RCONB664,SECURITIES LENT-CREDIT EQUIVALNT AMT
RCR,RCONB665,SECURITIES LENT - 0%
RCR,RCONB666,SECURITIES LENT - 20%
RCR,RCONB667,SECURITIES LENT - 50%
RCR,RCONB668,SECURITIES LENT - 100%
RCR,RCONB669,RECOURSE ON SMALL BUS OBLIG - EQUIV
RCR,RCONB670,RECOURSE ON SMALL BUS OBLIG - 0%
RCR,RCONB671,RECOURSE ON SMALL BUS OBLIG - 20%
RCR,RCONB672,RECOURSE ON SMALL BUS OBLIG - 50%
RCR,RCONB673,RECOURSE ON SMALL BUS OBLIG - 100%
RCR,RCONB674,FIN ASSETS W/LOW-LEVL REC - 100%
RCR,RCONB675,OTHR FNCL ASSETS SOLD W/RECRS ($AMT)
RCR,RCONB676,OTHR FNCL ASSETS SOLD W/RECRS (EQUIV
RCR,RCONB677,OTHR FNCL ASSETS SOLD W/RECRS-0%
RCR,RCONB678,OTHR FNCL ASSETS SOLD W/RECRS-20%
RCR,RCONB679,OTHR FNCL ASSETS SOLD W/RECRS-50%
RCR,RCONB680,OTHR FNCL ASSETS SOLD W/RECRS-100%
RCR,RCONB681,ALL OTH OFF-BALNCE SHEET LIABILITIES
RCR,RCONB682,ALL OTH OFF-BAL SHEET LIABS-CDT EQVL
RCR,RCONB683,ALL OTH OFF-BAL SHEET LIABILITIES-0%
RCR,RCONB684,ALL OTH OFF-BAL SHEET LIABILTIES-20%
RCR,RCONB685,ALL OTH OFF-BAL SHEET LIABILTIES-50%
RCR,RCONB686,ALL OTH OFF-BAL SHEET LIABLTIES-100%
RCR,RCONB687,"CMMTMNTS W/AN ORGNL MAT,ETC-CRD EQVL"
RCR,RCONB688,CMMTMTS W/AN ORGNL MAT EXCDNG 1YR-0%
RCR,RCONB689,CMMTMNTS W/AN ORGNL MAT EXCD 1YR-20%
RCR,RCONB690,CMMTMTS W/AN ORGNL MAT EXCDG 1YR-50%
RCR,RCONB691,CMMTMTS W/AN ORGNL MAT EXCD 1YR-100%
RCR,RCONB693,DERIVATIVE CONTRACTS - 0%
RCR,RCONB694,DERIVATIVE CONTRACTS - 20%
RCR,RCONB695,DERIVATIVE CONTRACTS - 50%
RCR,RCONB696,"TOT ASSTS,DERVTVS,&OFF-BAL SHT-0%"
RCR,RCONB697,"TOT ASSTS,DERVTVS,&OFF-BAL SHT - 20%"
RCR,RCONB698,"TOT ASTS,DERVTVS,&OFF-BAL SHT - 50%"
RCR,RCONB699,"TOT ASTS,DERVTVS,&OFF-BAL SHT - 100%"
RCR,RCONB700,RSK-WGHTD ASTS BY RSK WGHT CTGRY-0%
RCR,RCONB701,RSK-WGHTD ASTS BY RSK WGHT CTRY-20%
RCR,RCONB702,RSK-WGHTD ASTS BY RSK WGHT CTGRY-50%
RCR,RCONB703,RSK-WGHTD ASTS BY RSK WGH CTGRY-100%
RCR,RCONB704,RSK-WGHTD ASTS BEFORE DEDCTNS - 100%
RCS,RCONB705,"OTSTDNG PRNCPL BAL,ETC-1-4 FAM RESDL"
RCS,RCONB706,"OTSTDNG PRNCPL BAL OF,ETC-HM EQ LINS"
RCS,RCONB707,"OTSTDNG PRNCPL BAL OF,ETC-CR CRD RCV"
RCS,RCONB708,"OTSTDNG PRNCPL BAL OF,ETC-AUTO LOANS"
RCS,RCONB709,"OTSTDNG PRNCPL BAL OF,ETC-OT CSMR LN"
RCS,RCONB710,OTSTDNG PRNCPL BAL OF-CMMRL&INDU LNS
RCS,RCONB711,"OTSTDNG PRNCPL BAL OF,ETC-ALL OT LNS"
RCS,RCONB712,RETAINED INT-ONLY STRPS-1-4 FAM RESI
RCS,RCONB713,RETAINED INT-ONLY STRPS-HM EQY LINES
RCS,RCONB714,RETAINED INT-ONLY STRPS-CR CRD RCVBL
RCS,RCONB715,RETAINED INT-ONLY STRIPS-AUTO LOANS
RCS,RCONB716,RETAINED INT-ONLY STRPS-OTH CSMR LNS
RCS,RCONB717,RETAINED INT-ONLY STRPS-CMRL&IND LNS
RCS,RCONB718,RETAINED INT-ONLY STRPS-ALL OTHR LNS
RCS,RCONB719,STANDBY LETTRS OF CRDT-1-4 FAM RSDTL
RCS,RCONB720,STANDBY LETTRS OF CRDT-HM EQTY LINES
RCS,RCONB721,STANDBY LETTRS OF CRDT-CRDT CRD RCVB
RCS,RCONB722,STANDBY LETTERS OF CREDIT-AUTO LOANS
RCS,RCONB723,STANDBY LETTRS OF CRDT-OTH CNSMR LNS
RCS,RCONB724,STANDBY LETTRS OF CRDT-CMMRL&IND LNS
RCS,RCONB725,STANDBY LETTRS OF CRDT-ALL OTHER LNS
RCS,RCONB726,REPRTNG BNK'S UNUSD CMMTMTS-1-4 FAM
RCS,RCONB727,REPRTNG BNK'S UNUSD CMMTMTS-HM EQ LN
RCS,RCONB728,RPRTNG BNK'S UNUSD CMTMTS-CR CRD REC
RCS,RCONB729,REPRTNG BNK'S UNUSD CMMTMTS-AUTO LNS
RCS,RCONB730,RPRTNG BK'S UNUSD CMTMTS-OT CSMR LNS
RCS,RCONB731,RPRTNG BK'S UNUSD CMTMTS-C & I LOANS
RCS,RCONB732,RPRTING BK'S UNUSD CMTMTS-ALL OT LNS
RCS,RCONB733,PAST DUE LN AMTS:30-89 DYS FAMI RSDL
RCS,RCONB734,PAST DUE LOAN AMTS:30-89 DYS HM EQTY
RCS,RCONB735,PAST DUE LOAN AMTS:30-89 DYS CR CARD
RCS,RCONB736,PAS DUE LN AMTS:30-89 DYS AUTO LOANS
RCS,RCONB737,PAS DUE LN AMTS:30-89 DYS OT CSMR LN
RCS,RCONB738,PAS DU LN AMTS:30-89 DYS CML&IND LNS
RCS,RCONB739,PAS DU LN AMTS:30-89 DYS ALL OTH LNS
RCS,RCONB740,PAS DU LN AMTS:90 DAYS/MORE 1-4 FAM
RCS,RCONB741,PAS DUE LN AMTS:90 DYS/MOR HM EQY LN
RCS,RCONB742,PAS DU LN AMTS:90 DYS/MOR CR CRD RCV
RCS,RCONB743,PAST DUE LN AMTS:90 DYS/MOR AUTO LNS
RCS,RCONB744,PAS DUE LN AMTS:90 DYS/MOR OTH CNSMR
RCS,RCONB745,PAS DU LN AMTS:90 DYS/MOR CMMRL&IND
RCS,RCONB746,PAS DUE LN AMTS:90 DYS/MOR ALL OTHER
RCS,RCONB761,AMT OF OWNRSHP(SELLER)INT-HM EQTY LN
RCS,RCONB762,"AMT OF OWNRSHP(SELLER)INT,ETC-CR CRD"
RCS,RCONB763,"AMT OF OWNRSHP(SELLER) INT,ETC:C&I"
RCS,RCONB764,PAS DUE LN AMTS ETC 30-89 DYS HM EQY
RCS,RCONB765,"PAS DUE LN AMTS,ETC:30-89 DYS CR CRD"
RCS,RCONB766,"PAS DUE LN AMTS,ETC:30-89DYS CML&IND"
RCS,RCONB767,"PAS DU LN AMTS,ETC:90 DYS/MOR-HM EQY"
RCS,RCONB768,"PAS DUE LN AMTS,ETC:90DYS/MOR-CR CRD"
RCS,RCONB769,"PAS DUE LN AMTS,ETC:90DYS/MO-CML&IND"
RCS,RCONB776,"MAXI AMT OF CRDIT,ETC:1-4 FAMI RSDTL"
RCS,RCONB777,"MAXI AMT OF CRED,ETC:HOME EQTY LINES"
RCS,RCONB778,"MAXI AMT OF CREDIT,ETC:CRD CARD RCVB"
RCS,RCONB779,"MAXI AMOUNT OF CREDIT,ETC:AUTO LOANS"
RCS,RCONB780,"MAXI AMT OF CREDIT,ETC:OTH CNSMR LNS"
RCS,RCONB781,"MAXI AMT OF CREDIT,ETC:CMMRCL&INDUST"
RCS,RCONB782,"MAXI AMT OF CREDIT,ETC:ALL OTH LOANS"
RCS,RCONB783,RPRTNG BK'S UNUSD CMTMTS:1-4 FAM RSD
RCS,RCONB784,RPRTNG BK'S UNUSD CMTMTS:HM EQ LINES
RCS,RCONB785,RPRTNG BK'S UNUSD CMTMTS:CR CRD RCVB
RCS,RCONB786,RPRTNG BNK'S UNUSD CMTMTS:AUTO LOANS
RCS,RCONB787,RPRTNG BNK'S UNUSD CMTMTS:OT CSMR LN
RCS,RCONB788,RPRTNG BK'S UNUSD CMTMTS:CMMRL&INDUS
RCS,RCONB789,RPRTNG BK'S UNUSD CMTMTS:ALL OTH LNS
RCS,RCONB790,"ASSTS SLD W/RECOURSE,ETC:1-4 FAM RSD"
RCS,RCONB791,"ASSTS SLD W/RECOURSE,ETC:HM EQ LINES"
RCS,RCONB792,"ASSTS SLD W/RECOURSE,ETC:CR CARD RCV"
RCS,RCONB793,"ASSTS SLD W/RECOURSE,ETC:AUTO LOANS"
RCS,RCONB794,"ASSTS SLD W/RECOURSE,ETC:OT CSMR LNS"
RCS,RCONB795,"ASSTS SLD W/RECOURSE,ETC:CMMRL&INDUS"
RCS,RCONB796,"ASSTS SOLD W/RECOURSE,ETC:ALL OT LNS"
RCS,RCONB797,"MAXI AMT OF CREDIT,ETC:1-4 FAM RSDTL"
RCS,RCONB798,"MAXI AMT OF CREDIT,ETC:HM EQTY LINES"
RCS,RCONB799,"MAXI AMT OF CREDIT,ETC:CR CARD RCVBL"
RCS,RCONB800,"MAXI AMT OF CREDIT,ETC:AUTO LOANS"
RCS,RCONB801,"MAXI AMT OF CREDIT,ETC:OTH CNSMR LNS"
RCS,RCONB802,"MAXI AMT OF CREDIT,ETC:CMMRL&INDUSTL"
RCS,RCONB803,"MAXI AMT OF CREDIT,ETC:ALL OTH LOANS"
RCS,RCONB804,1-4FAM RES MORTGAGE SERVIC W/RECRS
RCS,RCONB805,1-4FAM RES MORTG SERVIC W/ NO RECR
RCS,RCONB806,"MAXI AMT OF,ETC:CONDUITS SPNSRD BANK"
RCS,RCONB807,"MAXI AMT OF,ETC:CONDUITS SPNSRD OTHR"
RCS,RCONB808,"UNUSED CMTMTS,ETC:CONDUITS SPNSRD BK"
RCS,RCONB809,"UNUSD CMTMTS,ETC:CONDUITS SPNSRD OTH"
RCN,RCONB834,P/D(30-89DA):LOANS TO DI'S - DERIVED
RCN,RCONB835,PD GE 90 DAY LN TO DI DERIVED
RCN,RCONB836,P/D(NONACCR):LOANS TO DI - DERIVED
RCCI,RCONB837,LNS SEC BY REAL ESTATE NON-US
RCB,RCONB838,HTM(COST): ABS - CREDIT CARD RECEIV
RCB,RCONB839,HTM(FAIR): ABS - CREDIT CARD RECEIV
RCB,RCONB840,AFS(COST): ABS - CREDIT CARD RECEIV
RCB,RCONB841,AFS(FAIR): ABS - CREDIT CARD RECEIV
RCB,RCONB842,HTM(COST): ABS - HOME EQUITY LINES
RCB,RCONB843,HTM(FAIR): ABS - HOME EQUITY LINES
RCB,RCONB844,AFS(COST): ABS - HOME EQUITY LINES
RCB,RCONB845,AFS(FAIR): ABS - HOME EQUITY LINES
RCB,RCONB846,HTM(COST): ABS - AUTOMOBILE LOANS
RCB,RCONB847,HTM(FAIR): ABS - AUTOMOBILE LOANS
RCB,RCONB848,AFS(COST): ABS - AUTOMOBILE LOANS
RCB,RCONB849,AFS(FAIR): ABS - AUTOMOBILE LOANS
RCB,RCONB850,HTM(COST): ABS- OTHER CONSUMER LOANS
RCB,RCONB851,HTM(FAIR): ABS- OTHER CONSUMER LOANS
RCB,RCONB852,AFS(COST): ABS- OTHER CONSUMER LOANS
RCB,RCONB853,AFS(FAIR): ABS- OTHER CONSUMER LOANS
RCB,RCONB854,HTM(COST): ABS- COMMRCIAL &IND LOANS
RCB,RCONB855,HTM(FAIR): ABS- COMMRCIAL &IND LOANS
RCB,RCONB856,AFS(COST): ABS- COMMRCIAL &IND LOANS
RCB,RCONB857,AFS(FAIR): ABS- COMMRCIAL &IND LOANS
RCB,RCONB858,HTM(COST): ASSET BACKED SEC - OTHER
RCB,RCONB859,HTM(FAIR): ASSET BACKED SEC - OTHER
RCB,RCONB860,AFS(COST): ASSET BACKED SEC - OTHER
RCB,RCONB861,AFS(FAIR): ASSET BACKED SEC - OTHER
RCT,RCONB867,DOES BK HAVE ANY FIDUCIARY/RLTD ACT?
RCT,RCONB868,PRSNL TRST/AGNCY ACCTS-MANAGD ASSETS
RCT,RCONB869,PRSNL TRST/AGCY ACCTS-NON-MAN ASSETS
RCT,RCONB870,PRSNL TRST/AGCY ACCTS NBR MANAGD ACC
RCT,RCONB871,PRSNL TRST/AGCY ACCTS NBR NON-MNG AC
RCT,RCONB872,EMPLOYEE BNFT-DEFND CNTRBTN-MAN ASTS
RCT,RCONB873,"EMPLOYEE BNFT-DEFND CNTRBTN-NON,ETC"
RCT,RCONB874,EMPLOYEE BNFT-DEFND CNTRBTN-# MANAGD
RCT,RCONB875,"EMPLOYEE BNFT-DEFD CNTRBTN MBR NON,E"
RCT,RCONB876,EMPLOYEE BNFT-DFND BNFT-MANAGD ASETS
RCT,RCONB877,"EMPLOYEE BNFT-DFND BNFT-NON-MNGD,ETC"
RCT,RCONB878,EMPLOYEE BNFT-DFND BNFT-# MNGD ACCTS
RCT,RCONB879,EMPLOYEE BNFT-DFND BNFT NBR NON-MNGD
RCT,RCONB880,OTH RETIREMENT ACCTS-MANAGED ASSETS
RCT,RCONB881,OTH RETIREMNT ACCTS-NON-MANGD ASSETS
RCT,RCONB882,OTH RETIREMNT ACCTS-# MANAGED ACCTS
RCT,RCONB883,OTH RETIREMNT ACCTS-# NON-MNGD ACCTS
RCT,RCONB884,CORP TRST/AGCY ACCTS-MANAGED ASSETS
RCT,RCONB885,CORP TRST/AGCY ACCTS-NON-MNGD ASSETS
RCT,RCONB886,INVMT MNGEMNT AGCY ACCTS-MNGD ASSETS
RCT,RCONB888,INVMT MNGEMT AGCY ACCTS-# MNGD ACCTS
RCT,RCONB890,OTHER FIDUCIARY ACCTS-MANAGED ASSETS
RCT,RCONB891,OTH FIDUCIARY ACCTS-NON-MNGED ASSETS
RCT,RCONB892,OTH FIDUCIARY ACCTS-# MANAGED ACCTS
RCT,RCONB893,OTH FIDUCIARY ACCTS NBR NON-MNGD ACC
RCT,RCONB894,TOTAL FIDUCIARY ACCTS-MANAGED ASSETS
RCT,RCONB895,TOTL FIDUCIARY ACCTS-NON-MNGD ASSETS
RCT,RCONB896,TOTL FIDUCIARY ACCTS-# MNGD ACCOUNTS
RCT,RCONB897,TOTL FIDUCIARY ACCTS-NON-MNGD ACCTS
RCT,RCONB898,CUSTODY/SAFEKEEPING ACCTS - NON-MNGD
RCT,RCONB899,CUSTODY/SAFEKEEPING ACCTS-# NON-MNGD
RCT,RCONB913,NON-INTEREST BEARING DEPOSITS
RCT,RCONB914,INTEREST-BEARING DEPOSITS
RCT,RCONB915,U.S. TREAS & U.S. GVMNT AGCY OBLGTNS
RCT,RCONB916,"STATE, COUNTY&MUNICIPAL OBLIGATIONS"
RCT,RCONB917,MONEY MARKET MUTUAL FUNDS
RCT,RCONB918,OTHER SHORT-TERM OBLIGATIONS
RCT,RCONB919,OTHER NOTES AND BONDS
RCT,RCONB920,COMMON AND PREFERRED STOCKS
RCT,RCONB921,REAL ESTATE MORTGAGES
RCT,RCONB922,REAL ESTATE
RCT,RCONB923,MISCELLANEOUS ASSETS
RCT,RCONB927,CORP/MUNCPL TRUSTEESHIP-# OF ISSUES
RCT,RCONB928,CORP/MUNCPL TRSTSHPS-PRNCPL AMT OTSD
RCT,RCONB929,"TRNSFR AGNT,REGSTRAR,ETC-# OF ISSUES"
RCT,RCONB931,DOMESTIC EQUITY - NUMBER OF FUNDS
RCT,RCONB932,DOMESTIC EQUITY-MKT VAL FUNDS ASSETS
RCT,RCONB933,INTERNATIONAL/GLOBAL EQTY-# OF FUNDS
RCT,RCONB934,INTERNTL/GLOBAL EQTY-MK VAL FND ASTS
RCT,RCONB935,STOCK/BOND BLEND - NUMBER OF FUNDS
RCT,RCONB936,STOCK/BOND BLEND-MK VAL FUND ASSETS
RCT,RCONB937,TAXABLE BOND - NUMBER OF FUNDS
RCT,RCONB938,TAXABLE BOND-MKT VALU OF FUND ASSETS
RCT,RCONB939,MUNICIPAL BOND - NUMBER OF FUNDS
RCT,RCONB940,MUNICIPAL BOND-MK VAL OF FUND ASSETS
RCT,RCONB941,SHRT TERM INVMTS/MONEY MK NBR OF FUN
RCT,RCONB942,"SHRT TERM INVMTS/MONEY MK-MK VAL,ETC"
RCT,RCONB943,SPECIALTY/OTHER - NUMBER OF FUNDS
RCT,RCONB944,SPECIALTY/OTHER-MKT VALU FUND ASSETS
RCT,RCONB945,TOT COLLECTVE INVMT FUNDS-# OF FUNDS
RCT,RCONB946,"TOT COLLECTVE INVMT FUNDS-MK VAL,ETC"
RC,RCONB987,FEDERAL FNDS SOLD IN DOMESTIC OFFICS
RC,RCONB989,SECURS PURCHSD UDR AGRMNTS TO RESELL
RC,RCONB993,FEDERAL FNDS PURCD IN DOMESTIC OFFCS
RC,RCONB995,SECURS SOLD UNDR AGRMNTS TO REPURCH
RCT,RCONC001,CORP TRST&AGNCY ACCTS NBR MANAGD ACC
RCT,RCONC002,CORP TRST&ACY ACCTS-# NON-MNGD ACCTS
